{
  "name": "12-bar blues in F",
  "chords": [
    {
      "id": 1,
      "name": "F7",
      "chord": "F7",
      "bass": "F2",
      "scale1": "F mixolydian",
      "scale2": "F lydian dominant",
      "scale3": "F mixolydian b6"
    },
    {
      "id": 2,
      "name": "Bb7",
      "chord": "Bb7",
      "bass": "Bb2",
      "scale1": "Bb mixolydian",
      "scale2": "Bb lydian dominant",
      "scale3": "Bb mixolydian b6"
    },
    {
      "id": 3,
      "name": "C7",
      "chord": "C7",
      "bass": "C2",
      "scale1": "C mixolydian",
      "scale2": "C lydian dominant",
      "scale3": "C mixolydian b6"
    }
  ],
  "options": {
    "key": {
      "tonic": "F",
      "type": "major",
      "source": "user"
    },
    "colour": "jazz"
  },
  "meta": {
    "type": "onekeyjam",
    "version": 2,
    "source": "https://onekeyjam.netlify.app"
  },
  "songs": {
    "default": {
      "ids": [
        1,
        2,
        3
      ],
      "favourites": [
        1,
        2,
        3
      ],
      "blacklist": []
    }
  },
  "chordSequences": {
    "default": {
      "mml": "t96o4c1d1c1c1d1d1c1c1e1d1c1e1",
      "markstart": 0,
      "markend": 192,
      "tempo": 96,
      "enabled": false,
      "loopManual": false,
      "label": "Excerpt (12 bars)"
    }
  }
}
