{
  "name": "ii-V-I in Eb major",
  "chords": [
    {
      "id": 1,
      "name": "Fm7",
      "chord": "Fm7",
      "bass": "F2",
      "scale1": "F dorian",
      "scale2": "F aeolian",
      "scale3": "F minor pentatonic"
    },
    {
      "id": 2,
      "name": "Bb7",
      "chord": "Bb7",
      "bass": "Bb2",
      "scale1": "Bb mixolydian",
      "scale2": "Bb lydian dominant",
      "scale3": "Bb mixolydian b6"
    },
    {
      "id": 3,
      "name": "Ebmaj7",
      "chord": "Ebmaj7",
      "bass": "Eb2",
      "scale1": "Eb major",
      "scale2": "Eb lydian",
      "scale3": "Eb harmonic major"
    }
  ],
  "options": {},
  "meta": {
    "type": "onekeyjam",
    "version": 2,
    "source": "https://onekeyjam.netlify.app"
  },
  "songs": {
    "default": {
      "ids": [
        1,
        2,
        3
      ],
      "favourites": [
        1,
        2,
        3
      ],
      "blacklist": []
    }
  }
}
