{
  "name": "Satin Doll - Jazz Classic",
  "chords": [
    {
      "name": "DM7 chord",
      "chord": "Dm7",
      "scale1": "D dorian",
      "scale2": "D aeolian",
      "scale3": "D minor pentatonic"
    },
    {
      "name": "G7 - dominant chord",
      "chord": "G7",
      "scale1": "G mixolydian",
      "scale2": "G lydian dominant",
      "scale3": "G mixolydian b6"
    },
    {
      "name": "EM7 chord",
      "chord": "EM7",
      "scale1": "E major",
      "scale2": "E lydian",
      "scale3": "E harmonic major"
    },
    {
      "name": "A7 - dominant chord",
      "chord": "A7",
      "scale1": "A mixolydian",
      "scale2": "A lydian dominant",
      "scale3": "A mixolydian b6"
    },
    {
      "name": "CM/Eb chord",
      "chord": "CM",
      "bass": "Eb",
      "scale1": "C major",
      "scale2": "C lydian",
      "scale3": "C mixolydian"
    },
    {
      "name": "D7 - dominant chord",
      "chord": "D7",
      "scale1": "D mixolydian",
      "scale2": "D lydian dominant",
      "scale3": "D mixolydian b6"
    },
    {
      "name": "Abm7 chord",
      "chord": "Abm7",
      "scale1": "Ab dorian",
      "scale2": "Ab aeolian",
      "scale3": "Ab minor pentatonic"
    },
    {
      "name": "Db7b9 ?? chord",
      "chord": "Db7b9",
      "scale1": "Db half-whole diminished",
      "scale2": "Db phrygian dominant",
      "scale3": "Db lydian dominant"
    },
    {
      "name": "C6 ?? chord",
      "chord": "C6",
      "scale1": "C major",
      "scale2": "C lydian",
      "scale3": "C major pentatonic"
    },
    {
      "name": "F chord",
      "chord": "FM",
      "scale1": "F lydian",
      "scale2": "F major",
      "scale3": "F mixolydian"
    },
    {
      "name": "A7b9 chord",
      "chord": "A7b9",
      "scale1": "A phrygian dominant",
      "scale2": "A half-whole diminished",
      "scale3": "A mixolydian"
    }
  ],
  "meta": {
    "type": "onekeyjam",
    "version": 2,
    "source": "https://onekeyjam.netlify.app"
  },
  "options": {
    "key": {
      "tonic": "C",
      "type": "major",
      "source": "user"
    }
  },
  "songs": {
    "default": {
      "ids": [],
      "favourites": [],
      "blacklist": []
    }
  }
}