{
  "name": "Brown Sugar - Rolling Stones in C",
  "chords": [
    {
      "id": 1,
      "name": "C",
      "chord": "C",
      "bass": "C2",
      "scale1": "C major",
      "scale2": "C lydian",
      "scale3": "C major pentatonic"
    },
    {
      "id": 2,
      "name": "G",
      "chord": "G",
      "bass": "G2",
      "scale1": "G mixolydian",
      "scale2": "G major",
      "scale3": "G major pentatonic"
    },
    {
      "id": 3,
      "name": "F",
      "chord": "F",
      "bass": "F2",
      "scale1": "F lydian",
      "scale2": "F major",
      "scale3": "F major pentatonic"
    },
    {
      "id": 4,
      "name": "C",
      "chord": "C",
      "bass": "C2",
      "scale1": "C major",
      "scale2": "C lydian",
      "scale3": "C major pentatonic"
    },
    {
      "id": 5,
      "name": "Bb",
      "chord": "Bb",
      "bass": "Bb2",
      "scale1": "Bb lydian",
      "scale2": "Bb major",
      "scale3": "Bb major pentatonic"
    },
    {
      "id": 6,
      "name": "F",
      "chord": "F",
      "bass": "F2",
      "scale1": "F lydian",
      "scale2": "F major",
      "scale3": "F major pentatonic"
    },
    {
      "id": 7,
      "name": "C",
      "chord": "C",
      "bass": "C2",
      "scale1": "C major",
      "scale2": "C lydian",
      "scale3": "C major pentatonic"
    },
    {
      "id": 8,
      "name": "G",
      "chord": "G",
      "bass": "G2",
      "scale1": "G mixolydian",
      "scale2": "G major",
      "scale3": "G major pentatonic"
    }
  ],
  "options": {
    "key": {
      "tonic": "C",
      "type": "major",
      "source": "user"
    },
    "colour": "diatonic"
  },
  "meta": {
    "type": "onekeyjam",
    "version": 2,
    "source": "https://onekeyjam.netlify.app"
  },
  "songs": {
    "default": {
      "ids": [
        1,
        2,
        3,
        4,
        5,
        6,
        7,
        8
      ],
      "favourites": [
        1,
        2,
        3,
        4,
        5,
        6,
        7,
        8
      ],
      "blacklist": []
    }
  }
}
