{
  "name": "Softly as in a Morning Sunrise in C minor",
  "chords": [
    {
      "id": 1,
      "name": "Cm7",
      "chord": "Cm7",
      "bass": "C2",
      "scale1": "C dorian",
      "scale2": "C aeolian",
      "scale3": "C minor pentatonic"
    },
    {
      "id": 2,
      "name": "Fm7",
      "chord": "Fm7",
      "bass": "F2",
      "scale1": "F dorian",
      "scale2": "F aeolian",
      "scale3": "F minor pentatonic"
    },
    {
      "id": 3,
      "name": "Dm7b5",
      "chord": "Dm7b5",
      "bass": "D2",
      "scale1": "D locrian #2",
      "scale2": "D locrian",
      "scale3": "D minor blues"
    },
    {
      "id": 4,
      "name": "G7",
      "chord": "G7",
      "bass": "G2",
      "scale1": "G phrygian dominant",
      "scale2": "G lydian dominant",
      "scale3": "G mixolydian"
    },
    {
      "id": 5,
      "name": "Abmaj7",
      "chord": "Abmaj7",
      "bass": "Ab2",
      "scale1": "Ab lydian",
      "scale2": "Ab major",
      "scale3": "Ab harmonic major"
    },
    {
      "id": 6,
      "name": "Abm7",
      "chord": "Abm7",
      "bass": "Ab2",
      "scale1": "Ab dorian",
      "scale2": "Ab aeolian",
      "scale3": "Ab minor pentatonic"
    },
    {
      "id": 7,
      "name": "Gm7",
      "chord": "Gm7",
      "bass": "G2",
      "scale1": "G dorian",
      "scale2": "G aeolian",
      "scale3": "G minor pentatonic"
    }
  ],
  "options": {
    "key": {
      "tonic": "C",
      "type": "minor",
      "source": "user"
    },
    "colour": "jazz",
    "scaleStyle": "follow"
  },
  "meta": {
    "type": "onekeyjam",
    "version": 2,
    "source": "https://onekeyjam.netlify.app"
  },
  "songs": {
    "default": {
      "ids": [
        1,
        2,
        3,
        4,
        5,
        6,
        7
      ],
      "favourites": [
        1,
        2,
        3,
        4,
        5,
        6,
        7
      ],
      "blacklist": []
    }
  },
  "chordSequences": {
    "default": {
      "mml": "t112o4c1&c1d1&d1c1&c1e1f1",
      "markstart": 0,
      "markend": 128,
      "tempo": 112,
      "enabled": false,
      "loopManual": false,
      "label": "Excerpt (8 bars)"
    },
    "medium": {
      "mml": "t112o4c1c1d1d1c1c1e1f1c1c1d1d1c1c1e1f1",
      "markstart": 0,
      "markend": 256,
      "tempo": 112,
      "enabled": false,
      "loopManual": false,
      "label": "Middle section (16 bars)"
    },
    "full": {
      "mml": "t112o4c1c1d1d1c1c1e1f1c1c1d1d1c1c1e1f1g1g1a1a1b1b1e1f1c1c1d1d1c1c1e1f1",
      "markstart": 0,
      "markend": 512,
      "tempo": 112,
      "enabled": false,
      "loopManual": false,
      "label": "Full form (32 bars)"
    }
  }
}
