{
  "name": "Andalusian cadence in A minor",
  "chords": [
    {
      "id": 1,
      "name": "Am",
      "chord": "Am",
      "bass": "A2",
      "scale1": "A aeolian",
      "scale2": "A dorian",
      "scale3": "A minor pentatonic"
    },
    {
      "id": 2,
      "name": "G",
      "chord": "G",
      "bass": "G2",
      "scale1": "G mixolydian",
      "scale2": "G major",
      "scale3": "G lydian"
    },
    {
      "id": 3,
      "name": "F",
      "chord": "F",
      "bass": "F2",
      "scale1": "F lydian",
      "scale2": "F major",
      "scale3": "F mixolydian"
    },
    {
      "id": 4,
      "name": "E7",
      "chord": "E7",
      "bass": "E2",
      "scale1": "E phrygian dominant",
      "scale2": "E lydian dominant",
      "scale3": "E mixolydian"
    }
  ],
  "options": {
    "key": {
      "tonic": "A",
      "type": "minor",
      "source": "user"
    },
    "colour": "jazz"
  },
  "meta": {
    "type": "onekeyjam",
    "version": 2,
    "source": "https://onekeyjam.netlify.app"
  },
  "songs": {
    "default": {
      "ids": [
        1,
        2,
        3,
        4
      ],
      "favourites": [
        1,
        2,
        3,
        4
      ],
      "blacklist": []
    }
  },
  "chordSequences": {
    "default": {
      "mml": "t120o4c1d1e1f1",
      "markstart": 0,
      "markend": 64,
      "tempo": 120,
      "enabled": false,
      "loopManual": false
    }
  }
}
