{
  "name": "I-vi-ii-V turnaround in F",
  "chords": [
    {
      "id": 1,
      "name": "Fmaj7",
      "chord": "Fmaj7",
      "bass": "F2",
      "scale1": "F major",
      "scale2": "F lydian",
      "scale3": "F harmonic major"
    },
    {
      "id": 2,
      "name": "Dm7",
      "chord": "Dm7",
      "bass": "D2",
      "scale1": "D dorian",
      "scale2": "D aeolian",
      "scale3": "D minor pentatonic"
    },
    {
      "id": 3,
      "name": "Gm7",
      "chord": "Gm7",
      "bass": "G2",
      "scale1": "G dorian",
      "scale2": "G aeolian",
      "scale3": "G minor pentatonic"
    },
    {
      "id": 4,
      "name": "C7",
      "chord": "C7",
      "bass": "C2",
      "scale1": "C mixolydian",
      "scale2": "C lydian dominant",
      "scale3": "C mixolydian b6"
    }
  ],
  "options": {
    "key": {
      "tonic": "F",
      "type": "major",
      "source": "user"
    },
    "colour": "jazz"
  },
  "meta": {
    "type": "onekeyjam",
    "version": 2,
    "source": "https://onekeyjam.netlify.app"
  },
  "songs": {
    "default": {
      "ids": [
        1,
        2,
        3,
        4
      ],
      "favourites": [
        1,
        2,
        3,
        4
      ],
      "blacklist": []
    }
  },
  "chordSequences": {
    "default": {
      "mml": "t120o4c1d1e1f1",
      "markstart": 0,
      "markend": 64,
      "tempo": 120,
      "enabled": false,
      "loopManual": false,
      "label": "Excerpt (4 bars)"
    }
  }
}
