{
  "name": "Alone Together in D minor",
  "chords": [
    {
      "id": 1,
      "name": "Dm7",
      "chord": "Dm7",
      "bass": "D2",
      "scale1": "D dorian",
      "scale2": "D aeolian",
      "scale3": "D minor pentatonic"
    },
    {
      "id": 2,
      "name": "Gm7",
      "chord": "Gm7",
      "bass": "G2",
      "scale1": "G dorian",
      "scale2": "G aeolian",
      "scale3": "G minor pentatonic"
    }
  ],
  "options": {
    "key": {
      "tonic": "D",
      "type": "minor",
      "source": "user"
    },
    "colour": "jazz"
  },
  "meta": {
    "type": "onekeyjam",
    "version": 2,
    "source": "https://onekeyjam.netlify.app"
  },
  "songs": {
    "default": {
      "ids": [
        1,
        2
      ],
      "favourites": [
        1,
        2
      ],
      "blacklist": []
    }
  },
  "chordSequences": {
    "default": {
      "mml": "t120o4c1&c1&c1&c1d1&d1c1&c1",
      "markstart": 0,
      "markend": 128,
      "tempo": 120,
      "enabled": false,
      "loopManual": false
    }
  }
}
