{
  "name": "I-vi-ii-V turnaround in D",
  "chords": [
    {
      "id": 1,
      "name": "Dmaj7",
      "chord": "Dmaj7",
      "bass": "D2",
      "scale1": "D major",
      "scale2": "D lydian",
      "scale3": "D harmonic major"
    },
    {
      "id": 2,
      "name": "Bm7",
      "chord": "Bm7",
      "bass": "B2",
      "scale1": "B dorian",
      "scale2": "B aeolian",
      "scale3": "B minor pentatonic"
    },
    {
      "id": 3,
      "name": "Em7",
      "chord": "Em7",
      "bass": "E2",
      "scale1": "E dorian",
      "scale2": "E aeolian",
      "scale3": "E minor pentatonic"
    },
    {
      "id": 4,
      "name": "A7",
      "chord": "A7",
      "bass": "A2",
      "scale1": "A mixolydian",
      "scale2": "A lydian dominant",
      "scale3": "A mixolydian b6"
    }
  ],
  "options": {
    "key": {
      "tonic": "D",
      "type": "major",
      "source": "user"
    },
    "colour": "jazz"
  },
  "meta": {
    "type": "onekeyjam",
    "version": 2,
    "source": "https://onekeyjam.netlify.app"
  },
  "songs": {
    "default": {
      "ids": [
        1,
        2,
        3,
        4
      ],
      "favourites": [
        1,
        2,
        3,
        4
      ],
      "blacklist": []
    }
  }
}
