{
  "name": "ii-V-I in F# major",
  "chords": [
    {
      "id": 1,
      "name": "G#m7",
      "chord": "G#m7",
      "bass": "G#2",
      "scale1": "G# dorian",
      "scale2": "G# aeolian",
      "scale3": "G# minor pentatonic"
    },
    {
      "id": 2,
      "name": "C#7",
      "chord": "C#7",
      "bass": "C#2",
      "scale1": "C# mixolydian",
      "scale2": "C# lydian dominant",
      "scale3": "C# mixolydian b6"
    },
    {
      "id": 3,
      "name": "F#maj7",
      "chord": "F#maj7",
      "bass": "F#2",
      "scale1": "F# major",
      "scale2": "F# lydian",
      "scale3": "F# harmonic major"
    }
  ],
  "options": {},
  "meta": {
    "type": "onekeyjam",
    "version": 2,
    "source": "https://onekeyjam.netlify.app"
  },
  "songs": {
    "default": {
      "ids": [
        1,
        2,
        3
      ],
      "favourites": [
        1,
        2,
        3
      ],
      "blacklist": []
    }
  }
}
